{
  "masterSenseId": "01a1070c-7c5a-7542-a092-beb09c96a03f",
  "masterLexemeId": "01a1070c-7c5a-7542-a092-bbc32cc229e3",
  "senseRevision": 1,
  "senseLabel": [
    {
      "language": "en",
      "text": "basic character"
    },
    {
      "language": "vi",
      "text": "bản chất"
    }
  ],
  "senseOrder": 1,
  "partOfSpeechCode": "NOUN",
  "usageRegister": [],
  "regionCodes": [],
  "grammarNotes": [],
  "translations": [
    {
      "translationId": "01a1070c-7c5a-7542-a092-c36a8fdf760a",
      "masterSenseId": "01a1070c-7c5a-7542-a092-beb09c96a03f",
      "language": "vi",
      "text": "bản chất",
      "translationKind": "EQUIVALENT",
      "isPreferred": true,
      "displayOrder": 0,
      "status": "DRAFT",
      "provenanceIds": [
        "01a10760-b9f0-7246-9ed0-fa6e6631d141"
      ]
    }
  ],
  "definitions": [
    {
      "definitionId": "01a1070c-7c5a-7542-a092-c4ef3be13630",
      "masterSenseId": "01a1070c-7c5a-7542-a092-beb09c96a03f",
      "language": "en",
      "text": "The basic character or qualities that make a person or thing what it is.",
      "definitionKind": "LEARNER_FRIENDLY",
      "displayOrder": 0,
      "status": "DRAFT",
      "provenanceIds": [
        "01a10760-b9f0-7ae4-96e6-4ae16404dc2c"
      ]
    }
  ],
  "examples": [
    {
      "exampleId": "01a1070c-7c5a-7542-a092-cb0d42a4b265",
      "masterSenseId": "01a1070c-7c5a-7542-a092-beb09c96a03f",
      "language": "en",
      "text": "Patience is part of her calm nature.",
      "register": "NEUTRAL",
      "displayOrder": 0,
      "audioAssetIds": [],
      "exampleTranslations": [
        {
          "exampleTranslationId": "01a1070c-7c5a-7542-a092-cc2727235ee5",
          "exampleId": "01a1070c-7c5a-7542-a092-cb0d42a4b265",
          "language": "vi",
          "text": "Sự kiên nhẫn là một phần trong bản tính điềm đạm của cô ấy.",
          "isPreferred": true,
          "displayOrder": 0,
          "status": "DRAFT",
          "provenanceIds": [
            "01a10760-b9f0-7cfc-9abc-6ed1df90808c"
          ]
        }
      ],
      "status": "DRAFT",
      "provenanceIds": [
        "01a10760-b9f0-756f-b225-e2c1efe9784b"
      ]
    }
  ],
  "pronunciationOverrides": [],
  "status": "DRAFT",
  "createdAt": "2026-10-04T13:13:41.210Z",
  "updatedAt": "2026-10-04T13:49:45.054Z",
  "provenanceIds": [
    "01a10760-b9f0-723e-8b66-85105057942f",
    "01a10760-b9f0-766d-80fc-58d8e0c0e27a"
  ]
}
