{
  "masterSenseId": "01a1070c-7c59-726e-88d5-2a10fa50c2ef",
  "masterLexemeId": "01a1070c-7c59-726e-88d5-2407b5177e60",
  "senseRevision": 1,
  "senseLabel": [
    {
      "language": "en",
      "text": "living animal"
    },
    {
      "language": "vi",
      "text": "sinh vật"
    }
  ],
  "senseOrder": 1,
  "partOfSpeechCode": "NOUN",
  "usageRegister": [],
  "regionCodes": [],
  "grammarNotes": [],
  "translations": [
    {
      "translationId": "01a1070c-7c59-726e-88d5-2f9b57ec8ca5",
      "masterSenseId": "01a1070c-7c59-726e-88d5-2a10fa50c2ef",
      "language": "vi",
      "text": "sinh vật",
      "translationKind": "EQUIVALENT",
      "isPreferred": true,
      "displayOrder": 0,
      "status": "DRAFT",
      "provenanceIds": [
        "01a10760-b9f0-7404-a015-1009ab13d63e"
      ]
    }
  ],
  "definitions": [
    {
      "definitionId": "01a1070c-7c59-726e-88d5-32b63e3abe6c",
      "masterSenseId": "01a1070c-7c59-726e-88d5-2a10fa50c2ef",
      "language": "en",
      "text": "A living animal or other being, especially one that can move.",
      "definitionKind": "LEARNER_FRIENDLY",
      "displayOrder": 0,
      "status": "DRAFT",
      "provenanceIds": [
        "01a10760-b9f0-7859-951e-fb7779e2f529"
      ]
    }
  ],
  "examples": [
    {
      "exampleId": "01a1070c-7c59-726e-88d5-378bbc4b1c4d",
      "masterSenseId": "01a1070c-7c59-726e-88d5-2a10fa50c2ef",
      "language": "en",
      "text": "A tiny sea creature hid beneath the smooth rock.",
      "register": "NEUTRAL",
      "displayOrder": 0,
      "audioAssetIds": [],
      "exampleTranslations": [
        {
          "exampleTranslationId": "01a1070c-7c59-726e-88d5-388d6f6cf8ae",
          "exampleId": "01a1070c-7c59-726e-88d5-378bbc4b1c4d",
          "language": "vi",
          "text": "Một sinh vật biển nhỏ ẩn dưới tảng đá nhẵn.",
          "isPreferred": true,
          "displayOrder": 0,
          "status": "DRAFT",
          "provenanceIds": [
            "01a10760-b9f0-739b-9746-645d5d78feca"
          ]
        }
      ],
      "status": "DRAFT",
      "provenanceIds": [
        "01a10760-b9f0-7605-bab2-3bd203d71cec"
      ]
    }
  ],
  "pronunciationOverrides": [],
  "status": "DRAFT",
  "createdAt": "2026-10-04T13:13:41.209Z",
  "updatedAt": "2026-10-04T13:13:41.209Z",
  "provenanceIds": [
    "01a10760-b9f0-7b96-ba6d-439915f72e76",
    "01a10760-b9f0-7e30-86c5-4095e52aa915"
  ]
}
