{
  "masterSenseId": "01a1070c-7c58-76b5-a2ac-007b8e765c31",
  "masterLexemeId": "01a1070c-7c57-7676-9acf-7f943f6c1e48",
  "senseRevision": 1,
  "senseLabel": [
    {
      "language": "en",
      "text": "per-hundred modifier"
    },
    {
      "language": "vi",
      "text": "dùng chỉ mức phần trăm"
    }
  ],
  "senseOrder": 1,
  "partOfSpeechCode": "ADJECTIVE",
  "usageRegister": [],
  "regionCodes": [],
  "grammarNotes": [],
  "translations": [
    {
      "translationId": "01a1070c-7c58-76b5-a2ac-0730ef4b369e",
      "masterSenseId": "01a1070c-7c58-76b5-a2ac-007b8e765c31",
      "language": "vi",
      "text": "phần trăm",
      "translationKind": "EQUIVALENT",
      "isPreferred": true,
      "displayOrder": 0,
      "status": "DRAFT",
      "provenanceIds": [
        "01a10760-b9f0-72d3-8791-b36094e62620"
      ]
    }
  ],
  "definitions": [
    {
      "definitionId": "01a1070c-7c58-76b5-a2ac-0b9bf82b20a6",
      "masterSenseId": "01a1070c-7c58-76b5-a2ac-007b8e765c31",
      "language": "en",
      "text": "Used after a number to describe a rate measured out of one hundred.",
      "definitionKind": "LEARNER_FRIENDLY",
      "displayOrder": 0,
      "status": "DRAFT",
      "provenanceIds": [
        "01a10760-b9f0-7376-964e-e0b88331de79"
      ]
    }
  ],
  "examples": [
    {
      "exampleId": "01a1070c-7c58-76b5-a2ac-0c4a591cb0a0",
      "masterSenseId": "01a1070c-7c58-76b5-a2ac-007b8e765c31",
      "language": "en",
      "text": "The bank added a two per cent fee to the transfer.",
      "register": "NEUTRAL",
      "displayOrder": 0,
      "audioAssetIds": [],
      "exampleTranslations": [
        {
          "exampleTranslationId": "01a1070c-7c59-726e-88d4-332cd588dee9",
          "exampleId": "01a1070c-7c58-76b5-a2ac-0c4a591cb0a0",
          "language": "vi",
          "text": "Ngân hàng cộng thêm khoản phí hai phần trăm vào giao dịch.",
          "isPreferred": true,
          "displayOrder": 0,
          "status": "DRAFT",
          "provenanceIds": [
            "01a10760-b9f0-725a-abca-4fe3e9e9c9c4"
          ]
        }
      ],
      "status": "DRAFT",
      "provenanceIds": [
        "01a10760-b9f0-7278-9e2f-1fad99fde7cb"
      ]
    }
  ],
  "pronunciationOverrides": [],
  "status": "DRAFT",
  "createdAt": "2026-10-04T13:13:41.208Z",
  "updatedAt": "2026-10-04T13:13:41.208Z",
  "provenanceIds": [
    "01a10760-b9f0-7242-81a3-b25cb7774b8a",
    "01a10760-b9f0-7395-b040-68938d301419"
  ]
}
