{
  "masterSenseId": "01a1070c-7c58-76b5-a2a9-f257db26d791",
  "masterLexemeId": "01a1070c-7c58-76b5-a2a9-eeda1efc4dce",
  "senseRevision": 3,
  "senseLabel": [
    {
      "language": "en",
      "text": "agreement or acceptance"
    },
    {
      "language": "vi",
      "text": "đồng ý"
    }
  ],
  "senseOrder": 1,
  "partOfSpeechCode": "INTERJECTION",
  "usageRegister": [],
  "regionCodes": [],
  "grammarNotes": [],
  "translations": [
    {
      "translationId": "01a1070c-7c58-76b5-a2a9-f6faad6dbdfa",
      "masterSenseId": "01a1070c-7c58-76b5-a2a9-f257db26d791",
      "language": "vi",
      "text": "được rồi",
      "translationKind": "EQUIVALENT",
      "isPreferred": true,
      "displayOrder": 0,
      "status": "APPROVED",
      "provenanceIds": [
        "01a10760-b9f0-71f5-962d-277deed6f5c5"
      ]
    }
  ],
  "definitions": [
    {
      "definitionId": "01a1070c-7c58-76b5-a2a9-fb002069219c",
      "masterSenseId": "01a1070c-7c58-76b5-a2a9-f257db26d791",
      "language": "en",
      "text": "Used to show that you agree with a suggestion or request.",
      "definitionKind": "LEARNER_FRIENDLY",
      "displayOrder": 0,
      "status": "APPROVED",
      "provenanceIds": [
        "01a10760-b9f0-7abb-a483-ccdc5c3a8e67"
      ]
    }
  ],
  "examples": [
    {
      "exampleId": "01a1070c-7c58-76b5-a2a9-ff9d2c9c1cb7",
      "masterSenseId": "01a1070c-7c58-76b5-a2a9-f257db26d791",
      "language": "en",
      "text": "All right, send me the schedule when you can.",
      "register": "NEUTRAL",
      "displayOrder": 0,
      "audioAssetIds": [],
      "exampleTranslations": [
        {
          "exampleTranslationId": "01a1070c-7c58-76b5-a2aa-02e7b725d194",
          "exampleId": "01a1070c-7c58-76b5-a2a9-ff9d2c9c1cb7",
          "language": "vi",
          "text": "Được, gửi lịch cho tôi khi nào tiện nhé.",
          "isPreferred": true,
          "displayOrder": 0,
          "status": "APPROVED",
          "provenanceIds": [
            "01a10760-b9f0-7297-a757-db44971b9226"
          ]
        }
      ],
      "status": "APPROVED",
      "provenanceIds": [
        "01a10760-b9f0-7501-98da-be2e666bb51e"
      ]
    }
  ],
  "pronunciationOverrides": [],
  "status": "APPROVED",
  "createdAt": "2026-10-04T13:13:41.208Z",
  "updatedAt": "2026-10-06T10:27:31.456Z",
  "provenanceIds": [
    "01a10760-b9f0-73f7-8fc7-5de980dd1e08",
    "01a10760-b9f0-7c46-a3c1-82838f33a4e1"
  ]
}
