{
  "masterSenseId": "01a0fc13-09ef-7e09-a527-a47867da6730",
  "masterLexemeId": "01a0fc13-09ef-7021-a00d-86bc169fe0df",
  "senseRevision": 1,
  "senseLabel": [
    {
      "language": "en",
      "text": "stage performance"
    },
    {
      "language": "vi",
      "text": "vở kịch"
    }
  ],
  "senseOrder": 1,
  "partOfSpeechCode": "NOUN",
  "usageRegister": [],
  "regionCodes": [],
  "grammarNotes": [],
  "translations": [
    {
      "translationId": "01a0fc13-09ef-7b78-b0dd-9d66fd869621",
      "masterSenseId": "01a0fc13-09ef-7e09-a527-a47867da6730",
      "language": "vi",
      "text": "vở kịch",
      "translationKind": "EQUIVALENT",
      "isPreferred": true,
      "displayOrder": 0,
      "provenanceIds": [
        "01a0fc13-09ef-72e8-9401-9b2609c71f6d"
      ],
      "status": "IN_REVIEW"
    }
  ],
  "definitions": [
    {
      "definitionId": "01a0fc13-09ef-7524-93c1-eb0cabcae48e",
      "masterSenseId": "01a0fc13-09ef-7e09-a527-a47867da6730",
      "language": "en",
      "text": "A story written to be performed by actors on a stage.",
      "definitionKind": "LEARNER_FRIENDLY",
      "displayOrder": 0,
      "provenanceIds": [
        "01a0fc13-09ef-7285-9715-75de949e3daa"
      ],
      "status": "IN_REVIEW"
    }
  ],
  "examples": [
    {
      "exampleId": "01a0fc13-09ef-72ba-b1da-08f5314961e5",
      "masterSenseId": "01a0fc13-09ef-7e09-a527-a47867da6730",
      "language": "en",
      "text": "The school is putting on a play next week.",
      "register": "NEUTRAL",
      "levelNotes": "Editorial example for this Sense; this note does not assert CEFR alignment.",
      "displayOrder": 0,
      "exampleTranslations": [
        {
          "exampleTranslationId": "01a0fc13-09ef-76ca-bcee-f29bb7e2e7dc",
          "exampleId": "01a0fc13-09ef-72ba-b1da-08f5314961e5",
          "language": "vi",
          "text": "Trường sẽ dựng một vở kịch vào tuần tới.",
          "isPreferred": true,
          "displayOrder": 0,
          "provenanceIds": [
            "01a0fc13-09ef-7ba2-9dcb-b571e6baab93"
          ],
          "status": "IN_REVIEW"
        }
      ],
      "audioAssetIds": [],
      "provenanceIds": [
        "01a0fc13-09ef-70ef-a1cd-020660e384b2"
      ],
      "status": "IN_REVIEW"
    }
  ],
  "pronunciationOverrides": [],
  "provenanceIds": [
    "01a0fc13-09ef-7fee-950c-0a729887793a"
  ],
  "status": "IN_REVIEW",
  "createdAt": "2026-10-02T00:00:00Z",
  "updatedAt": "2026-10-02T00:00:00Z"
}
