{
  "masterSenseId": "01a1070c-7c58-76b5-a2aa-0a20d4f7ae01",
  "masterLexemeId": "01a1070c-7c58-76b5-a2aa-052cbb68ebbb",
  "senseRevision": 1,
  "senseLabel": [
    {
      "language": "en",
      "text": "one of a kind"
    },
    {
      "language": "vi",
      "text": "độc nhất"
    }
  ],
  "senseOrder": 1,
  "partOfSpeechCode": "ADJECTIVE",
  "usageRegister": [],
  "regionCodes": [],
  "grammarNotes": [],
  "translations": [
    {
      "translationId": "01a1070c-7c58-76b5-a2aa-0d3b7e360875",
      "masterSenseId": "01a1070c-7c58-76b5-a2aa-0a20d4f7ae01",
      "language": "vi",
      "text": "độc đáo",
      "translationKind": "EQUIVALENT",
      "isPreferred": true,
      "displayOrder": 0,
      "status": "DRAFT",
      "provenanceIds": [
        "01a10760-b9f0-7655-941b-19d758f6e1f8"
      ]
    }
  ],
  "definitions": [
    {
      "definitionId": "01a1070c-7c58-76b5-a2aa-104b84092165",
      "masterSenseId": "01a1070c-7c58-76b5-a2aa-0a20d4f7ae01",
      "language": "en",
      "text": "Being the only one of its kind, with no exact match elsewhere.",
      "definitionKind": "LEARNER_FRIENDLY",
      "displayOrder": 0,
      "status": "DRAFT",
      "provenanceIds": [
        "01a10760-b9f0-76f6-ab8f-cec09031e5ba"
      ]
    }
  ],
  "examples": [
    {
      "exampleId": "01a1070c-7c58-76b5-a2aa-1403c6d9284a",
      "masterSenseId": "01a1070c-7c58-76b5-a2aa-0a20d4f7ae01",
      "language": "en",
      "text": "The manuscript is the only surviving copy, so it is unique.",
      "register": "NEUTRAL",
      "displayOrder": 0,
      "audioAssetIds": [],
      "exampleTranslations": [
        {
          "exampleTranslationId": "01a1070c-7c58-76b5-a2aa-1bbc1be3f64a",
          "exampleId": "01a1070c-7c58-76b5-a2aa-1403c6d9284a",
          "language": "vi",
          "text": "Bản thảo này là bản duy nhất còn lại nên có một không hai.",
          "isPreferred": true,
          "displayOrder": 0,
          "status": "DRAFT",
          "provenanceIds": [
            "01a10760-b9f0-7155-8c9f-25dd6957c393"
          ]
        }
      ],
      "status": "DRAFT",
      "provenanceIds": [
        "01a10760-b9f0-7be6-81a2-f556954df8f2"
      ]
    }
  ],
  "pronunciationOverrides": [],
  "status": "DRAFT",
  "createdAt": "2026-10-04T13:13:41.208Z",
  "updatedAt": "2026-10-04T13:49:45.054Z",
  "provenanceIds": [
    "01a10760-b9f0-70aa-b767-1b1c8f735e41",
    "01a10760-b9f0-7419-ac04-ae969687fca2"
  ]
}
