{
  "masterSenseId": "01a0fc13-09ee-7211-8e5a-784c689a0c7a",
  "masterLexemeId": "01a0fc13-09ed-77ca-b066-98b5169c16b8",
  "senseRevision": 1,
  "senseLabel": [
    {
      "language": "en",
      "text": "financial institution"
    },
    {
      "language": "vi",
      "text": "ngân hàng"
    }
  ],
  "senseOrder": 1,
  "partOfSpeechCode": "NOUN",
  "usageRegister": [],
  "regionCodes": [],
  "grammarNotes": [],
  "translations": [
    {
      "translationId": "01a0fc13-09ee-7361-828e-95ee6e59ee22",
      "masterSenseId": "01a0fc13-09ee-7211-8e5a-784c689a0c7a",
      "language": "vi",
      "text": "ngân hàng",
      "translationKind": "EQUIVALENT",
      "isPreferred": true,
      "displayOrder": 0,
      "provenanceIds": [
        "01a0fc13-09ee-7602-a87f-a3960077d5c6"
      ],
      "status": "IN_REVIEW"
    }
  ],
  "definitions": [
    {
      "definitionId": "01a0fc13-09ee-7db4-93a1-795b4c5acc47",
      "masterSenseId": "01a0fc13-09ee-7211-8e5a-784c689a0c7a",
      "language": "en",
      "text": "An organization that keeps and lends money and provides financial services.",
      "definitionKind": "LEARNER_FRIENDLY",
      "displayOrder": 0,
      "provenanceIds": [
        "01a0fc13-09ee-7a57-b197-0ee77a38f963"
      ],
      "status": "IN_REVIEW"
    }
  ],
  "examples": [
    {
      "exampleId": "01a0fc13-09ee-7a73-b99c-fe636e2e77cf",
      "masterSenseId": "01a0fc13-09ee-7211-8e5a-784c689a0c7a",
      "language": "en",
      "text": "She deposited her paycheck at the bank.",
      "register": "NEUTRAL",
      "levelNotes": "Editorial example for this Sense; this note does not assert CEFR alignment.",
      "displayOrder": 0,
      "exampleTranslations": [
        {
          "exampleTranslationId": "01a0fc13-09ee-77b8-97aa-e9c8c4f7ef4f",
          "exampleId": "01a0fc13-09ee-7a73-b99c-fe636e2e77cf",
          "language": "vi",
          "text": "Cô ấy gửi tiền lương vào ngân hàng.",
          "isPreferred": true,
          "displayOrder": 0,
          "provenanceIds": [
            "01a0fc13-09ee-7532-a32b-b1fd6c2b0451"
          ],
          "status": "IN_REVIEW"
        }
      ],
      "audioAssetIds": [],
      "provenanceIds": [
        "01a0fc13-09ee-710e-bf7a-5f6a8faf6bea"
      ],
      "status": "IN_REVIEW"
    }
  ],
  "pronunciationOverrides": [],
  "provenanceIds": [
    "01a0fc13-09ee-7389-bf71-3c9acce30486"
  ],
  "status": "IN_REVIEW",
  "createdAt": "2026-10-02T00:00:00Z",
  "updatedAt": "2026-10-02T00:00:00Z"
}
