{
  "masterSenseId": "01a1070c-7c57-7676-9acf-2166c93ae47a",
  "masterLexemeId": "01a1070c-7c57-7676-9acf-1cc31ebc0b93",
  "senseRevision": 2,
  "senseLabel": [
    {
      "language": "en",
      "text": "historical period"
    },
    {
      "language": "vi",
      "text": "thời kỳ lịch sử"
    }
  ],
  "senseOrder": 1,
  "partOfSpeechCode": "NOUN",
  "usageRegister": [],
  "regionCodes": [],
  "grammarNotes": [],
  "translations": [
    {
      "translationId": "01a1070c-7c57-7676-9acf-27742f21235d",
      "masterSenseId": "01a1070c-7c57-7676-9acf-2166c93ae47a",
      "language": "vi",
      "text": "thời đại",
      "translationKind": "EQUIVALENT",
      "isPreferred": true,
      "displayOrder": 0,
      "status": "DRAFT",
      "provenanceIds": [
        "01a10760-b9f0-7c92-ac73-628310d1f5c8"
      ]
    }
  ],
  "definitions": [
    {
      "definitionId": "01a1070c-7c57-7676-9acf-2a8a4bdc2879",
      "masterSenseId": "01a1070c-7c57-7676-9acf-2166c93ae47a",
      "language": "en",
      "text": "A particular period in history marked by shared conditions or events.",
      "definitionKind": "LEARNER_FRIENDLY",
      "displayOrder": 0,
      "status": "DRAFT",
      "provenanceIds": [
        "01a10760-b9f0-7cfb-bac6-0d05c653d698"
      ]
    }
  ],
  "examples": [
    {
      "exampleId": "01a1070c-7c57-7676-9acf-2fb8520361db",
      "masterSenseId": "01a1070c-7c57-7676-9acf-2166c93ae47a",
      "language": "en",
      "text": "The invention changed travel during the industrial age.",
      "register": "NEUTRAL",
      "displayOrder": 0,
      "audioAssetIds": [],
      "exampleTranslations": [
        {
          "exampleTranslationId": "01a1070c-7c57-7676-9acf-309bb72edac0",
          "exampleId": "01a1070c-7c57-7676-9acf-2fb8520361db",
          "language": "vi",
          "text": "Phát minh đó đã thay đổi việc đi lại trong thời đại công nghiệp.",
          "isPreferred": true,
          "displayOrder": 0,
          "status": "DRAFT",
          "provenanceIds": [
            "01a10760-b9f0-7ee0-a4a7-76b5d1b1e2ee"
          ]
        }
      ],
      "status": "DRAFT",
      "provenanceIds": [
        "01a10760-b9f0-702c-b1bb-45457e462fcc"
      ]
    }
  ],
  "pronunciationOverrides": [],
  "status": "APPROVED",
  "createdAt": "2026-10-04T13:13:41.207Z",
  "updatedAt": "2026-10-04T13:13:41.207Z",
  "provenanceIds": [
    "01a10760-b9f0-7050-850e-2dfd265094d3",
    "01a10760-b9f0-7d47-85a0-5c6388f1280b"
  ]
}
