{
  "masterSenseId": "01a1070c-7c58-76b5-a2a8-d1cd64c3eada",
  "masterLexemeId": "01a1070c-7c58-76b5-a2a8-ce6bd8416ffe",
  "senseRevision": 3,
  "senseLabel": [
    {
      "language": "en",
      "text": "serious student or researcher"
    },
    {
      "language": "vi",
      "text": "học giả"
    }
  ],
  "senseOrder": 1,
  "partOfSpeechCode": "NOUN",
  "usageRegister": [],
  "regionCodes": [],
  "grammarNotes": [],
  "translations": [
    {
      "translationId": "01a1070c-7c58-76b5-a2a8-d7925a5ee844",
      "masterSenseId": "01a1070c-7c58-76b5-a2a8-d1cd64c3eada",
      "language": "vi",
      "text": "học giả",
      "translationKind": "EQUIVALENT",
      "isPreferred": true,
      "displayOrder": 0,
      "status": "APPROVED",
      "provenanceIds": [
        "01a10760-b9f0-7a51-9a9b-1f55e4cee5de"
      ]
    }
  ],
  "definitions": [
    {
      "definitionId": "01a1070c-7c58-76b5-a2a8-db67e4043325",
      "masterSenseId": "01a1070c-7c58-76b5-a2a8-d1cd64c3eada",
      "language": "en",
      "text": "A person who studies a subject deeply and knows a great deal about it.",
      "definitionKind": "LEARNER_FRIENDLY",
      "displayOrder": 0,
      "status": "APPROVED",
      "provenanceIds": [
        "01a10760-b9f0-786b-85a4-9385726311b8"
      ]
    }
  ],
  "examples": [
    {
      "exampleId": "01a1070c-7c58-76b5-a2a8-de99524bc1ab",
      "masterSenseId": "01a1070c-7c58-76b5-a2a8-d1cd64c3eada",
      "language": "en",
      "text": "The scholar spent years studying ancient maps of the coast.",
      "register": "NEUTRAL",
      "displayOrder": 0,
      "audioAssetIds": [],
      "exampleTranslations": [
        {
          "exampleTranslationId": "01a1070c-7c58-76b5-a2a8-e1a40b6d3994",
          "exampleId": "01a1070c-7c58-76b5-a2a8-de99524bc1ab",
          "language": "vi",
          "text": "Học giả dành nhiều năm nghiên cứu bản đồ cổ về bờ biển.",
          "isPreferred": true,
          "displayOrder": 0,
          "status": "APPROVED",
          "provenanceIds": [
            "01a10760-b9f0-735e-bbd4-448d724899d9"
          ]
        }
      ],
      "status": "APPROVED",
      "provenanceIds": [
        "01a10760-b9f0-7054-9055-f430a984d466"
      ]
    }
  ],
  "pronunciationOverrides": [],
  "status": "APPROVED",
  "createdAt": "2026-10-04T13:13:41.208Z",
  "updatedAt": "2026-10-06T10:27:31.456Z",
  "provenanceIds": [
    "01a10760-b9f0-731f-b52f-15bd4f1b14a6",
    "01a10760-b9f0-774e-9159-a5007327ed86"
  ]
}
