{
  "masterSenseId": "01a1070c-7c57-7676-9acf-6a88ac566599",
  "masterLexemeId": "01a1070c-7c57-7676-9acf-648a5a63fad8",
  "senseRevision": 1,
  "senseLabel": [
    {
      "language": "en",
      "text": "regular behavior"
    },
    {
      "language": "vi",
      "text": "thói quen thường ngày"
    }
  ],
  "senseOrder": 1,
  "partOfSpeechCode": "NOUN",
  "usageRegister": [],
  "regionCodes": [],
  "grammarNotes": [],
  "translations": [
    {
      "translationId": "01a1070c-7c57-7676-9acf-6c82deb7273f",
      "masterSenseId": "01a1070c-7c57-7676-9acf-6a88ac566599",
      "language": "vi",
      "text": "thói quen",
      "translationKind": "EQUIVALENT",
      "isPreferred": true,
      "displayOrder": 0,
      "status": "DRAFT",
      "provenanceIds": [
        "01a10760-b9f0-73f4-8c99-42519689ec1b"
      ]
    }
  ],
  "definitions": [
    {
      "definitionId": "01a1070c-7c57-7676-9acf-73c16ebb47d4",
      "masterSenseId": "01a1070c-7c57-7676-9acf-6a88ac566599",
      "language": "en",
      "text": "Something that you do regularly, often without thinking about it.",
      "definitionKind": "LEARNER_FRIENDLY",
      "displayOrder": 0,
      "status": "DRAFT",
      "provenanceIds": [
        "01a10760-b9f0-7fd8-a2e7-ce8b53885f80"
      ]
    }
  ],
  "examples": [
    {
      "exampleId": "01a1070c-7c57-7676-9acf-75861fe4502b",
      "masterSenseId": "01a1070c-7c57-7676-9acf-6a88ac566599",
      "language": "en",
      "text": "Reading before bed became a relaxing habit for him.",
      "register": "NEUTRAL",
      "displayOrder": 0,
      "audioAssetIds": [],
      "exampleTranslations": [
        {
          "exampleTranslationId": "01a1070c-7c57-7676-9acf-7bbf1c89bb63",
          "exampleId": "01a1070c-7c57-7676-9acf-75861fe4502b",
          "language": "vi",
          "text": "Đọc sách trước khi ngủ trở thành thói quen thư giãn của anh ấy.",
          "isPreferred": true,
          "displayOrder": 0,
          "status": "DRAFT",
          "provenanceIds": [
            "01a10760-b9f0-7258-966a-2cfecccb7f03"
          ]
        }
      ],
      "status": "DRAFT",
      "provenanceIds": [
        "01a10760-b9f0-7fe9-9d43-0a1d79db1119"
      ]
    }
  ],
  "pronunciationOverrides": [],
  "status": "DRAFT",
  "createdAt": "2026-10-04T13:13:41.207Z",
  "updatedAt": "2026-10-04T13:13:41.207Z",
  "provenanceIds": [
    "01a10760-b9f0-7500-b983-52dede63afc6",
    "01a10760-b9f0-7cc1-a33b-137d5b94bcb7"
  ]
}
