{
  "masterSenseId": "01a1070c-7c58-76b5-a2a9-0030193008ca",
  "masterLexemeId": "01a1070c-7c58-76b5-a2a8-fff9a54fdf74",
  "senseRevision": 2,
  "senseLabel": [
    {
      "language": "en",
      "text": "turn around an axis"
    },
    {
      "language": "vi",
      "text": "xoay quanh trục"
    }
  ],
  "senseOrder": 2,
  "partOfSpeechCode": "VERB",
  "usageRegister": [],
  "regionCodes": [],
  "grammarNotes": [],
  "translations": [
    {
      "translationId": "01a1070c-7c58-76b5-a2a9-045c963c38c5",
      "masterSenseId": "01a1070c-7c58-76b5-a2a9-0030193008ca",
      "language": "vi",
      "text": "xoay",
      "translationKind": "EQUIVALENT",
      "isPreferred": true,
      "displayOrder": 0,
      "status": "DRAFT",
      "provenanceIds": [
        "01a10760-b9f0-78cb-a8bc-03bb03c4fb63"
      ]
    }
  ],
  "definitions": [
    {
      "definitionId": "01a1070c-7c58-76b5-a2a9-09c7224a100d",
      "masterSenseId": "01a1070c-7c58-76b5-a2a9-0030193008ca",
      "language": "en",
      "text": "To turn around a central point while remaining in the same general place.",
      "definitionKind": "LEARNER_FRIENDLY",
      "displayOrder": 0,
      "status": "DRAFT",
      "provenanceIds": [
        "01a10760-b9f0-7f48-8ef8-6f42bf0d77a1"
      ]
    }
  ],
  "examples": [
    {
      "exampleId": "01a1070c-7c58-76b5-a2a9-0cf46c40843c",
      "masterSenseId": "01a1070c-7c58-76b5-a2a9-0030193008ca",
      "language": "en",
      "text": "The display rotates slowly above the entrance.",
      "register": "NEUTRAL",
      "displayOrder": 0,
      "audioAssetIds": [],
      "exampleTranslations": [
        {
          "exampleTranslationId": "01a1070c-7c58-76b5-a2a9-1163ed19aeb0",
          "exampleId": "01a1070c-7c58-76b5-a2a9-0cf46c40843c",
          "language": "vi",
          "text": "Màn hình xoay chậm phía trên lối vào.",
          "isPreferred": true,
          "displayOrder": 0,
          "status": "DRAFT",
          "provenanceIds": [
            "01a10760-b9f0-75d5-be1a-a4b9721afa4d"
          ]
        }
      ],
      "status": "DRAFT",
      "provenanceIds": [
        "01a10760-b9f0-7dac-8a88-6785f06c8119"
      ]
    }
  ],
  "pronunciationOverrides": [],
  "status": "APPROVED",
  "createdAt": "2026-10-04T13:13:41.208Z",
  "updatedAt": "2026-10-04T13:13:41.208Z",
  "provenanceIds": [
    "01a10760-b9f0-700e-a654-8fc84f715f99",
    "01a10760-b9f0-7c7f-8c2d-65405e7d64ad"
  ]
}
