{
  "masterSenseId": "01a1070c-7c58-76b5-a2aa-7e0812b069ae",
  "masterLexemeId": "01a1070c-7c58-76b5-a2aa-785336c8dc64",
  "senseRevision": 1,
  "senseLabel": [
    {
      "language": "en",
      "text": "lessening of pain"
    },
    {
      "language": "vi",
      "text": "sự giảm đau"
    }
  ],
  "senseOrder": 2,
  "partOfSpeechCode": "NOUN",
  "usageRegister": [],
  "regionCodes": [],
  "grammarNotes": [],
  "translations": [
    {
      "translationId": "01a1070c-7c58-76b5-a2aa-8152d8e7f0e8",
      "masterSenseId": "01a1070c-7c58-76b5-a2aa-7e0812b069ae",
      "language": "vi",
      "text": "sự giảm đau",
      "translationKind": "EQUIVALENT",
      "isPreferred": true,
      "displayOrder": 0,
      "status": "DRAFT"
    }
  ],
  "definitions": [
    {
      "definitionId": "01a1070c-7c58-76b5-a2aa-84f693dcbd1e",
      "masterSenseId": "01a1070c-7c58-76b5-a2aa-7e0812b069ae",
      "language": "en",
      "text": "A reduction in pain or discomfort after treatment or a change.",
      "definitionKind": "LEARNER_FRIENDLY",
      "displayOrder": 0,
      "status": "DRAFT"
    }
  ],
  "examples": [
    {
      "exampleId": "01a1070c-7c58-76b5-a2aa-8b71cd06ef6c",
      "masterSenseId": "01a1070c-7c58-76b5-a2aa-7e0812b069ae",
      "language": "en",
      "text": "The cool cloth brought relief to her aching forehead.",
      "register": "NEUTRAL",
      "displayOrder": 0,
      "audioAssetIds": [],
      "exampleTranslations": [
        {
          "exampleTranslationId": "01a1070c-7c58-76b5-a2aa-8cfeba4921f4",
          "exampleId": "01a1070c-7c58-76b5-a2aa-8b71cd06ef6c",
          "language": "vi",
          "text": "Khăn mát giúp làm dịu cơn đau ở trán cô ấy.",
          "isPreferred": true,
          "displayOrder": 0,
          "status": "DRAFT"
        }
      ],
      "status": "DRAFT"
    }
  ],
  "pronunciationOverrides": [],
  "status": "DRAFT",
  "createdAt": "2026-10-04T13:13:41.208Z",
  "updatedAt": "2026-10-04T13:13:41.208Z"
}
