{
  "masterSenseId": "01a1070c-7c58-76b5-a2aa-20e7d1e01c66",
  "masterLexemeId": "01a1070c-7c58-76b5-a2aa-1c3612353f47",
  "senseRevision": 1,
  "senseLabel": [
    {
      "language": "en",
      "text": "related to business"
    },
    {
      "language": "vi",
      "text": "thuộc hoạt động kinh doanh"
    }
  ],
  "senseOrder": 1,
  "partOfSpeechCode": "ADJECTIVE",
  "usageRegister": [],
  "regionCodes": [],
  "grammarNotes": [],
  "translations": [
    {
      "translationId": "01a1070c-7c58-76b5-a2aa-2467e42d0076",
      "masterSenseId": "01a1070c-7c58-76b5-a2aa-20e7d1e01c66",
      "language": "vi",
      "text": "thuộc thương mại",
      "translationKind": "EQUIVALENT",
      "isPreferred": true,
      "displayOrder": 0,
      "status": "DRAFT",
      "provenanceIds": [
        "01a10760-b9f0-728c-98d6-463953b9f508"
      ]
    }
  ],
  "definitions": [
    {
      "definitionId": "01a1070c-7c58-76b5-a2aa-28c952c1af3b",
      "masterSenseId": "01a1070c-7c58-76b5-a2aa-20e7d1e01c66",
      "language": "en",
      "text": "Connected with buying and selling goods or providing services for profit.",
      "definitionKind": "LEARNER_FRIENDLY",
      "displayOrder": 0,
      "status": "DRAFT",
      "provenanceIds": [
        "01a10760-b9f0-7796-9632-fff892b8f522"
      ]
    }
  ],
  "examples": [
    {
      "exampleId": "01a1070c-7c58-76b5-a2aa-2e4c24423172",
      "masterSenseId": "01a1070c-7c58-76b5-a2aa-20e7d1e01c66",
      "language": "en",
      "text": "The street has become a busy commercial district.",
      "register": "NEUTRAL",
      "displayOrder": 0,
      "audioAssetIds": [],
      "exampleTranslations": [
        {
          "exampleTranslationId": "01a1070c-7c58-76b5-a2aa-3088a8b4755a",
          "exampleId": "01a1070c-7c58-76b5-a2aa-2e4c24423172",
          "language": "vi",
          "text": "Con phố đã trở thành một khu thương mại sầm uất.",
          "isPreferred": true,
          "displayOrder": 0,
          "status": "DRAFT",
          "provenanceIds": [
            "01a10760-b9f0-7573-9c05-9afb43431866"
          ]
        }
      ],
      "status": "DRAFT",
      "provenanceIds": [
        "01a10760-b9f0-7b5a-a188-c94756e324ae"
      ]
    }
  ],
  "pronunciationOverrides": [],
  "status": "DRAFT",
  "createdAt": "2026-10-04T13:13:41.208Z",
  "updatedAt": "2026-10-04T13:13:41.208Z",
  "provenanceIds": [
    "01a10760-b9f0-7131-be91-f1d12837e6c0",
    "01a10760-b9f0-7602-b774-ecbd1ec37c8c"
  ]
}
