{
  "masterSenseId": "01a1070c-7c58-76b5-a2ab-369dd574695b",
  "masterLexemeId": "01a0fc13-09ef-7e5d-b757-aa456f0cd969",
  "senseRevision": 2,
  "senseLabel": [
    {
      "language": "en",
      "text": "hesitation or doubt"
    },
    {
      "language": "vi",
      "text": "sự dè dặt"
    }
  ],
  "senseOrder": 2,
  "partOfSpeechCode": "NOUN",
  "usageRegister": [],
  "regionCodes": [],
  "grammarNotes": [],
  "translations": [
    {
      "translationId": "01a1070c-7c58-76b5-a2ab-385d7dbf7ec1",
      "masterSenseId": "01a1070c-7c58-76b5-a2ab-369dd574695b",
      "language": "vi",
      "text": "sự dè dặt",
      "translationKind": "EQUIVALENT",
      "isPreferred": true,
      "displayOrder": 0,
      "status": "DRAFT",
      "provenanceIds": [
        "01a10760-b9f0-7e81-96be-d494c65cd1f9"
      ]
    }
  ],
  "definitions": [
    {
      "definitionId": "01a1070c-7c58-76b5-a2ab-3e6fc0a4a71b",
      "masterSenseId": "01a1070c-7c58-76b5-a2ab-369dd574695b",
      "language": "en",
      "text": "A feeling of doubt that makes someone cautious about agreeing.",
      "definitionKind": "LEARNER_FRIENDLY",
      "displayOrder": 0,
      "status": "DRAFT",
      "provenanceIds": [
        "01a10760-b9f0-70bb-b178-be7eea845166"
      ]
    }
  ],
  "examples": [
    {
      "exampleId": "01a1070c-7c58-76b5-a2ab-412270f2f330",
      "masterSenseId": "01a1070c-7c58-76b5-a2ab-369dd574695b",
      "language": "en",
      "text": "He accepted the offer, though he had one reservation about the schedule.",
      "register": "NEUTRAL",
      "displayOrder": 0,
      "audioAssetIds": [],
      "exampleTranslations": [
        {
          "exampleTranslationId": "01a1070c-7c58-76b5-a2ab-440e22e9fe72",
          "exampleId": "01a1070c-7c58-76b5-a2ab-412270f2f330",
          "language": "vi",
          "text": "Anh chấp nhận lời đề nghị dù vẫn có chút dè dặt về lịch trình.",
          "isPreferred": true,
          "displayOrder": 0,
          "status": "DRAFT",
          "provenanceIds": [
            "01a10760-b9f0-7b20-a856-09053f24a2cc"
          ]
        }
      ],
      "status": "DRAFT",
      "provenanceIds": [
        "01a10760-b9f0-7f16-9821-7518ba05c373"
      ]
    }
  ],
  "pronunciationOverrides": [],
  "status": "APPROVED",
  "createdAt": "2026-10-04T13:13:41.208Z",
  "updatedAt": "2026-10-04T13:13:41.208Z",
  "provenanceIds": [
    "01a10760-b9f0-77bf-a475-20182ccb5ba7",
    "01a10760-b9f0-7b03-ab01-67308772fe97"
  ]
}
