{
  "masterSenseId": "01a1070c-7c58-76b5-a2a9-d9fe7b7d857e",
  "masterLexemeId": "01a1070c-7c58-76b5-a2a9-d6f9af783ab6",
  "senseRevision": 3,
  "senseLabel": [
    {
      "language": "en",
      "text": "person in a group"
    },
    {
      "language": "vi",
      "text": "thành viên của nhóm"
    }
  ],
  "senseOrder": 1,
  "partOfSpeechCode": "NOUN",
  "usageRegister": [],
  "regionCodes": [],
  "grammarNotes": [],
  "translations": [
    {
      "translationId": "01a1070c-7c58-76b5-a2a9-dd60b7649f17",
      "masterSenseId": "01a1070c-7c58-76b5-a2a9-d9fe7b7d857e",
      "language": "vi",
      "text": "thành viên",
      "translationKind": "EQUIVALENT",
      "isPreferred": true,
      "displayOrder": 0,
      "status": "APPROVED",
      "provenanceIds": [
        "01a10760-b9f0-7ab5-9209-aeefba01d299"
      ]
    }
  ],
  "definitions": [
    {
      "definitionId": "01a1070c-7c58-76b5-a2a9-e20b3e145c1c",
      "masterSenseId": "01a1070c-7c58-76b5-a2a9-d9fe7b7d857e",
      "language": "en",
      "text": "A person who belongs to a group, club, or organization.",
      "definitionKind": "LEARNER_FRIENDLY",
      "displayOrder": 0,
      "status": "APPROVED",
      "provenanceIds": [
        "01a10760-b9f0-7b58-b823-4664d7020d8d"
      ]
    }
  ],
  "examples": [
    {
      "exampleId": "01a1070c-7c58-76b5-a2a9-e49b6ffa37f0",
      "masterSenseId": "01a1070c-7c58-76b5-a2a9-d9fe7b7d857e",
      "language": "en",
      "text": "Each member can borrow three books at a time.",
      "register": "NEUTRAL",
      "displayOrder": 0,
      "audioAssetIds": [],
      "exampleTranslations": [
        {
          "exampleTranslationId": "01a1070c-7c58-76b5-a2a9-ebeba3d917ce",
          "exampleId": "01a1070c-7c58-76b5-a2a9-e49b6ffa37f0",
          "language": "vi",
          "text": "Mỗi thành viên có thể mượn ba cuốn sách cùng lúc.",
          "isPreferred": true,
          "displayOrder": 0,
          "status": "APPROVED",
          "provenanceIds": [
            "01a10760-b9f0-76e1-ae6c-5db324c278de"
          ]
        }
      ],
      "status": "APPROVED",
      "provenanceIds": [
        "01a10760-b9f0-7b03-a25b-0caa2a4efa21"
      ]
    }
  ],
  "pronunciationOverrides": [],
  "status": "APPROVED",
  "createdAt": "2026-10-04T13:13:41.208Z",
  "updatedAt": "2026-10-06T10:27:31.456Z",
  "provenanceIds": [
    "01a10760-b9f0-75b6-aad0-ea91da20f847",
    "01a10760-b9f0-7e3a-9e53-e2e181eefa67"
  ]
}
