{
  "masterSenseId": "01a1070c-7c58-76b5-a2ab-a764716f4128",
  "masterLexemeId": "01a1070c-7c58-76b5-a2ab-a268368f74c1",
  "senseRevision": 3,
  "senseLabel": [
    {
      "language": "en",
      "text": "number of deaths and injuries"
    },
    {
      "language": "vi",
      "text": "số người chết và bị thương"
    }
  ],
  "senseOrder": 1,
  "partOfSpeechCode": "NOUN",
  "usageRegister": [],
  "regionCodes": [],
  "grammarNotes": [],
  "translations": [
    {
      "translationId": "01a1070c-7c58-76b5-a2ab-a92d0941a240",
      "masterSenseId": "01a1070c-7c58-76b5-a2ab-a764716f4128",
      "language": "vi",
      "text": "thiệt hại về người",
      "translationKind": "EQUIVALENT",
      "isPreferred": true,
      "displayOrder": 0,
      "status": "APPROVED",
      "provenanceIds": [
        "01a10760-b9f0-7672-bd6b-acedaff3661e"
      ]
    }
  ],
  "definitions": [
    {
      "definitionId": "01a1070c-7c58-76b5-a2ab-aee29974043c",
      "masterSenseId": "01a1070c-7c58-76b5-a2ab-a764716f4128",
      "language": "en",
      "text": "The number of people killed or injured by an accident or disaster.",
      "definitionKind": "LEARNER_FRIENDLY",
      "displayOrder": 0,
      "status": "APPROVED",
      "provenanceIds": [
        "01a10760-b9f0-72d3-b853-a4c179ee315d"
      ]
    }
  ],
  "examples": [
    {
      "exampleId": "01a1070c-7c58-76b5-a2ab-b0a4d18ff995",
      "masterSenseId": "01a1070c-7c58-76b5-a2ab-a764716f4128",
      "language": "en",
      "text": "The full toll of deaths and injuries from the storm became clear by morning.",
      "register": "NEUTRAL",
      "displayOrder": 0,
      "audioAssetIds": [],
      "exampleTranslations": [
        {
          "exampleTranslationId": "01a1070c-7c58-76b5-a2ab-b4a09d5346a9",
          "exampleId": "01a1070c-7c58-76b5-a2ab-b0a4d18ff995",
          "language": "vi",
          "text": "Đến sáng, số người chết và bị thương do cơn bão đã được xác định.",
          "isPreferred": true,
          "displayOrder": 0,
          "status": "APPROVED",
          "provenanceIds": [
            "01a10760-b9f0-7c3c-9351-0cfc94549d0b"
          ]
        }
      ],
      "status": "APPROVED",
      "provenanceIds": [
        "01a10760-b9f0-7114-a2f1-57642bf23c94"
      ]
    }
  ],
  "pronunciationOverrides": [],
  "status": "APPROVED",
  "createdAt": "2026-10-04T13:13:41.208Z",
  "updatedAt": "2026-10-06T10:27:31.456Z",
  "provenanceIds": [
    "01a10760-b9f0-7894-92d4-7720ef5a0f44",
    "01a10760-b9f0-7b90-b80f-37a2ca0abba7"
  ]
}
