{
  "masterSenseId": "01a1070c-7c5a-7542-a092-e7df11b3bc0a",
  "masterLexemeId": "01a1070c-7c59-726e-88d4-f4bbbedf1005",
  "senseRevision": 2,
  "senseLabel": [
    {
      "language": "en",
      "text": "act of trading"
    },
    {
      "language": "vi",
      "text": "việc trao đổi"
    }
  ],
  "senseOrder": 1,
  "partOfSpeechCode": "NOUN",
  "usageRegister": [],
  "regionCodes": [],
  "grammarNotes": [],
  "translations": [
    {
      "translationId": "01a1070c-7c5a-7542-a092-ebbc540bce45",
      "masterSenseId": "01a1070c-7c5a-7542-a092-e7df11b3bc0a",
      "language": "vi",
      "text": "sự trao đổi",
      "translationKind": "EQUIVALENT",
      "isPreferred": true,
      "displayOrder": 0,
      "status": "DRAFT",
      "provenanceIds": [
        "01a10760-b9f0-7508-82bb-11f3fa39e5ad"
      ]
    }
  ],
  "definitions": [
    {
      "definitionId": "01a1070c-7c5a-7542-a092-ed5ae4e63249",
      "masterSenseId": "01a1070c-7c5a-7542-a092-e7df11b3bc0a",
      "language": "en",
      "text": "The act of giving something and receiving something else in return.",
      "definitionKind": "LEARNER_FRIENDLY",
      "displayOrder": 0,
      "status": "DRAFT",
      "provenanceIds": [
        "01a10760-b9f0-7e56-98ca-f7da7cc0d4a4"
      ]
    }
  ],
  "examples": [
    {
      "exampleId": "01a1070c-7c5a-7542-a092-f28755034e4b",
      "masterSenseId": "01a1070c-7c5a-7542-a092-e7df11b3bc0a",
      "language": "en",
      "text": "The exchange of ideas helped both teams improve the design.",
      "register": "NEUTRAL",
      "displayOrder": 0,
      "audioAssetIds": [],
      "exampleTranslations": [
        {
          "exampleTranslationId": "01a1070c-7c5a-7542-a092-f7fb9896866b",
          "exampleId": "01a1070c-7c5a-7542-a092-f28755034e4b",
          "language": "vi",
          "text": "Việc trao đổi ý tưởng giúp cả hai nhóm cải thiện thiết kế.",
          "isPreferred": true,
          "displayOrder": 0,
          "status": "DRAFT",
          "provenanceIds": [
            "01a10760-b9f0-7014-8b15-79ff4170a0e5"
          ]
        }
      ],
      "status": "DRAFT",
      "provenanceIds": [
        "01a10760-b9f0-7ed9-a02b-732e11786db9"
      ]
    }
  ],
  "pronunciationOverrides": [],
  "status": "APPROVED",
  "createdAt": "2026-10-04T13:13:41.210Z",
  "updatedAt": "2026-10-04T13:13:41.210Z",
  "provenanceIds": [
    "01a10760-b9f0-7635-95a4-e9ecdd6bd404",
    "01a10760-b9f0-7938-8b9c-f713cf914c30"
  ]
}
