{
  "masterSenseId": "01a1070c-7c58-76b5-a2aa-f3a4a21a7dc3",
  "masterLexemeId": "01a1070c-7c58-76b5-a2aa-ef2e16608a0c",
  "senseRevision": 1,
  "senseLabel": [
    {
      "language": "en",
      "text": "captivating"
    },
    {
      "language": "vi",
      "text": "cuốn hút"
    }
  ],
  "senseOrder": 1,
  "partOfSpeechCode": "ADJECTIVE",
  "usageRegister": [],
  "regionCodes": [],
  "grammarNotes": [],
  "translations": [
    {
      "translationId": "01a1070c-7c58-76b5-a2aa-f5db177a89de",
      "masterSenseId": "01a1070c-7c58-76b5-a2aa-f3a4a21a7dc3",
      "language": "vi",
      "text": "cuốn hút",
      "translationKind": "EQUIVALENT",
      "isPreferred": true,
      "displayOrder": 0,
      "status": "DRAFT"
    }
  ],
  "definitions": [
    {
      "definitionId": "01a1070c-7c58-76b5-a2aa-fbb9861b85de",
      "masterSenseId": "01a1070c-7c58-76b5-a2aa-f3a4a21a7dc3",
      "language": "en",
      "text": "So interesting that it holds someone's attention.",
      "definitionKind": "LEARNER_FRIENDLY",
      "displayOrder": 0,
      "status": "DRAFT"
    }
  ],
  "examples": [
    {
      "exampleId": "01a1070c-7c58-76b5-a2aa-fc6fa448523c",
      "masterSenseId": "01a1070c-7c58-76b5-a2aa-f3a4a21a7dc3",
      "language": "en",
      "text": "The mystery novel was so compelling that I read it in one night.",
      "register": "NEUTRAL",
      "displayOrder": 0,
      "audioAssetIds": [],
      "exampleTranslations": [
        {
          "exampleTranslationId": "01a1070c-7c58-76b5-a2ab-00eb986f6004",
          "exampleId": "01a1070c-7c58-76b5-a2aa-fc6fa448523c",
          "language": "vi",
          "text": "Cuốn tiểu thuyết trinh thám hấp dẫn đến mức tôi đọc hết trong một đêm.",
          "isPreferred": true,
          "displayOrder": 0,
          "status": "DRAFT"
        }
      ],
      "status": "DRAFT"
    }
  ],
  "pronunciationOverrides": [],
  "status": "DRAFT",
  "createdAt": "2026-10-04T13:13:41.208Z",
  "updatedAt": "2026-10-04T14:11:49.155Z"
}
